{
  "contract": "search-market-snapshot@1.0",
  "meta": {
    "title": "搜索市场快照 · 模板测试",
    "subtitle": "通用演示数据",
    "footer": "Generated by commerce-ui"
  },
  "shell": {
    "brand_mark": "UI",
    "brand_title": "Template Pack",
    "brand_subtitle": "search-market-snapshot",
    "nav_label": "Views",
    "status": ["Fixture ready", "2 views"],
    "search": false
  },
  "views": [
    {
      "id": "overview",
      "label": "Overview",
      "title": "Overview",
      "subtitle": "Replace this fixture with a representative case.",
      "blocks": [
        {"type": "callout", "text": "先看经营判断，再查看图表来源。"},
        {"type": "bar_chart", "title": "价格带商品", "unit": "商品数", "denominator": "自然位去重商品", "source": "测试数据", "items": [{"label": "低价", "value": 20, "display": "20"}, {"label": "中价", "value": 12, "display": "12"}]},
        {"type": "grid", "columns": 2, "items": [
          {"type": "card", "title": "Purpose", "blocks": [{"type": "text", "text": "Describe the report decision."}]},
          {"type": "card", "title": "Evidence", "blocks": [{"type": "key_values", "items": [{"label": "Status", "value": "Verified"}]}]}
        ]}
      ]
    },
    {
      "id": "details",
      "label": "Details",
      "title": "Details",
      "subtitle": "Second independent view.",
      "blocks": [
        {"type": "table", "title": "Example", "columns": [{"key": "name", "label": "Name"}, {"key": "value", "label": "Value"}], "rows": [{"name": "Contract", "value": "search-market-snapshot@1.0"}]}
      ]
    }
  ]
}
